Summary,Description,Issue Type,Priority,Component/s,Status
authentication failed attempting fetch command,receiving following error attempting fetch commandgit c diffmnemonicprefixfalse c corequotepathfalse nooptionallocks fetch prune notags originfatal authentication failed configured account using personal tokenwhen clicking remote option able access depository still fetch command fails,bug,High,branch,Needs Triage
oauth token keeps expiring,refreshed oauth token yesterday need today navigating refresh facility major pain keep time incidentally refresh page automatically opens browser usually says something likeh site cant reachedlocalhost refused connecttry checking connection checking proxy firewallchromeerrorchromewebdatabuttonserrconnectionrefused,bug,Low,General,Needs Triage
unable start sourcetree updating older version,updating installation sourcetree sourcetree enterprise edition version result able open software splashscreen appears suddenly disappear sourcetree start uninstalled installed without clearing user appdata local appdata run issueserrors sourcetree logs codejavaerror sourcetreecompositionvsmefnetcompositionexceptionhelper log compositionexception errors occurred discoveryerror sourcetreecompositionvsmefnetcompositionexceptionhelper log aggregate exceptionsystemaggregateexception une ou plusieurs erreurs se sont produites microsoftvisualstudiocompositionpartdiscoveryexception reflectiontypeloadexception enumerating types assembly cprogram files xatlassiansourcetreesourcetreehostbitbucketdll results incomplete systemreflectionreflectiontypeloadexception impossible de charger un ou plusieurs des types requis extrayez la proprit loaderexceptions pour plus dinformations systemreflectionruntimemodulegettypesruntimemodule module systemreflectionassemblygettypes microsoftvisualstudiocompositionpartdiscoverycdisplayclasscreateassemblydiscoveryblockchainbassembly fin de la trace de la pile dexception interne fin de la trace de la pile dexception interne exception interne microsoftvisualstudiocompositionpartdiscoveryexception reflectiontypeloadexception enumerating types assembly cprogram files xatlassiansourcetreesourcetreehostbitbucketdll results incomplete systemreflectionreflectiontypeloadexception impossible de charger un ou plusieurs des types requis extrayez la proprit loaderexceptions pour plus dinformations systemreflectionruntimemodulegettypesruntimemodule module systemreflectionassemblygettypes microsoftvisualstudiocompositionpartdiscoverycdisplayclasscreateassemblydiscoveryblockchainbassembly fin de la trace de la pile dexception interne error sourcetreecompositionvsmefnetcompositionexceptionhelper log partdiscoveryexceptionmicrosoftvisualstudiocompositionpartdiscoveryexception reflectiontypeloadexception enumerating types assembly cprogram files xatlassiansourcetreesourcetreehostbitbucketdll results incomplete systemreflectionreflectiontypeloadexception impossible de charger un ou plusieurs des types requis extrayez la proprit loaderexceptions pour plus dinformations systemreflectionruntimemodulegettypesruntimemodule module systemreflectionassemblygettypes microsoftvisualstudiocompositionpartdiscoverycdisplayclasscreateassemblydiscoveryblockchainbassembly fin de la trace de la pile dexception interne error sourcetreecompositionvsmefnetcompositionexceptionhelper log typeloadexceptionsystemtypeloadexception impossible de charger le type bitbuckitnetapimodeltwozeroworkspace partir de lassembly bitbuckitnetapi version cultureneutral publickeytokennullerror sourcetreecompositionvsmefnetcompositionexceptionhelper log reflectiontypeloadexceptionsystemreflectionreflectiontypeloadexception impossible de charger un ou plusieurs des types requis extrayez la proprit loaderexceptions pour plus dinformations systemreflectionruntimemodulegettypesruntimemodule module systemreflectionassemblygettypes microsoftvisualstudiocompositionpartdiscoverycdisplayclasscreateassemblydiscoveryblockchainbassembly acode,bug,Medium,General,Needs Triage
keesp asking github login,oauth token issued application keeps blocking push github asking login login dialog work keep going tools authentication edit resiisue oauth token every commit annoying,bug,Medium,Git,Needs Triage
dark theme history changed files displayed correctly,changed files history screen displayed color scheme makes hard read dark theme activethe current file selected one affected seen history file status screen unstaged files staged files panels stash screen wellwhy annoying due reading path file common practice way impossible without mousing,bug,Low,UX,Needs Triage
unable know time pm,use french version column date format history show time h format without pm rather windows preferences using h format im unable easily know commit time pm,bug,Low,General,Needs Triage
fix git buffer overflow cve cve,multiple products security advisory git buffer overflow cve cve versions sourcetree mac windows vulnerable new version msi,bug,High,General,Closed
failed start windows update,cannot start sourcetree anymore getting error logcodejavaerror sourcetreeapp log failed startsystemmanagementmanagementexception invalid class systemmanagementmanagementexceptionthrowwithextendedinfomanagementstatus errorcode systemmanagementmanagementobjectcollectionmanagementobjectenumeratormovenext sourcetreeuithemewpfutilitiesnativehelpergetwindowsversion sourcetreeuithemewpfcontrolspermonitordpiwindowonsourceinitializedeventargs e systemwindowswindowcreatesourcewindowboolean duringshow systemwindowswindowshowhelperobject booleanbox systemwindowswindowshowdialog sourcetreeuiwelcomewizardmanagerrun sourcetreeuionboardingmanagerrun sourcetreeapprootonboard sourcetreeapprootonboardifrequired sourcetreeapprootonstartupdmovenext coderemoving folders reinstalling doesnt help,bug,High,General,Closed
history view column sizes madness,windows h screen size sometimes end wide description field dateauthorcommit end outside visible window impossible get three columns take needed space right leave rest description people probably would wantno amount doubleclicking dragging column headings let achieve ends like thisimagepngdoubleclicking left border date gives thisimagepngok doubleclick border date author et voilimagepngdoubleclick yet border author commitimagepngok maybe doubleclick right border commit headerimagepngback started lets drag descriptiondate border insteadimagepngmaybe scroll left try adjustimagepngand onesimagepng author wide lets scroll back left try fixing thatimagepngso far goodimagepngbut commit way wide lets adjust itwe need scroll right drag end borderimagepngyep yep dateauthorcommit rightonly thing left fix widen description field max available keeping three current size im trying drag descriptiondate border bam moving one pixel reverts thisimagepngback started top resets random ways every time restart andor switch repositories see srctreewin,bug,High,UX,Needs Triage
upadate embedded git binary create new release,according security advisory multiple products security advisory git buffer overflow cve cve sourcetree updated version release switch external updated git version mitigation,bug,High,Git,Closed
failed update,try update application options update menu get following errormethod found void sharpcompressreadersireaderextensionswriteentrytofilesharpcompressreadersireader systemstring sharpcompressreadersextractionoptions,bug,Low,General,Closed
broken link,link broken working,bug,High,REST,Gathering Impact
unable log sourcetree,first time trying log sourcetree since getting atlassian account unable log atlassian account app windows device refreshing popout window work clicking go atlassian button leads dead link,bug,Medium,General,Closed
app freezes displays responding titlebar constantly,latest update made sourcetree windows resulted app constantly freezing displaying responding titlebar occurs almost every time try use app never done latest update,bug,High,General,Needs Triage
sourcetree,adding large number files sourcetree remain responding long time choose submissionhowever files loaded completely sourcetree seems goes well next time choose submission problem comes tried use github desktop show submission history problem didnt happen appit seems bad logic loading files code plan fix,bug,Low,Git,Needs Triage
sourcetree crashs soon start,application crashes seconds starting repeated attempts application eventually start without crashing using sourcetree windows build error message logerror sourcetreeapp log exception thrown taskschedulersystemthreadingtaskstaskschedulerexception exception thrown taskscheduler systemnullreferenceexception object reference set instance object sourcetreeutilspriorityschedulerqueuetasktask task systemthreadingtaskstaskscheduleandstartboolean needsprotection end inner exception stack trace systemthreadingtaskstaskscheduleandstartboolean needsprotection systemthreadingtaskstaskinternalstartnewtask creatingtask delegate action object state cancellationtoken cancellationtoken taskscheduler scheduler taskcreationoptions options internaltaskoptions internaloptions stackcrawlmark stackmark systemthreadingtaskstaskfactorystartnewaction action cancellationtoken cancellationtoken taskcreationoptions creationoptions taskscheduler scheduler sourcetreeviewmodelbookmarksbookmarkspanelviewmodelcdisplayclassrefreshrepositorysummarybbookmarknode item sourcetreeutilsextensionscdisplayclassforeachasyncbdmovenext end stack trace previous location exception thrown systemruntimeexceptionservicesexceptiondispatchinfothrow systemruntimecompilerservicestaskawaiterhandlenonsuccessanddebuggernotificationtask task systemruntimecompilerservicestaskawaitergetresult sourcetreeviewmodelbookmarksbookmarkspanelviewmodelrefreshrepositorysummarydmovenext end stack trace previous location exception thrown systemruntimeexceptionservicesexceptiondispatchinfothrow systemruntimecompilerservicestaskawaiterhandlenonsuccessanddebuggernotificationtask task systemruntimecompilerservicestaskawaitergetresult sourcetreeviewmodelbookmarksbookmarkspanelviewmodelinitasyncdmovenext end stack trace previous location exception thrown systemruntimeexceptionservicesexceptiondispatchinfothrow systemruntimecompilerservicestaskawaiterhandlenonsuccessanddebuggernotificationtask task systemruntimecompilerservicestaskawaitergetresult sourcetreeviewbookmarksbookmarkspanelbookmarkspaneldatacontextchangeddmovenext end stack trace previous location exception thrown systemruntimeexceptionservicesexceptiondispatchinfothrow systemwindowsthreadingexceptionwrapperinternalrealcalldelegate callback object args int numargs systemwindowsthreadingexceptionwrappertrycatchwhenobject source delegate callback object args int numargs delegate catchhandler,bug,Highest,General,Needs Triage
sourcetree crashes shortly launching application,currently cant use sourcetree windows application workstation issued company application installs simply closes couple seconds launched behavior identical three workstations sourcetree evaluatedwindows hardware specifics th gen intelr coretm ih gb ram windows pro hos build installation defaults selected throughout following error occurs imagepngafter clicking cancel installer appears download mercurial second attempt successful apparentlyafter installation completes attempting launch sourcetree crashes sourcetreelog following recordst loghost initializing normal modeerror sourcetreenotificationsnotificationsmanager log unable set owner parent visible nonexistenterror sourcetreeapp log failed startsystemcomponentmodelwinexception x access denied systemdiagnosticsprocessstartwithshellexecuteexprocessstartinfo startinfo systemdiagnosticsprocessstartprocessstartinfo startinfo sourcetreesecuritypageantsshkeyagentlaunchboolean promptforkeyifblank string keyfile sourcetreesecuritydefaultsshkeymanagerlaunchsshagentboolean promptforkeyifblank string keyfile sourcetreesecuritydefaultsshkeymanagerlaunchsshagentboolean promptforkeyifblank sourcetreeapprootonboardifrequired sourcetreeapprootonstartupdmovenext end stack trace previous location exception thrown systemruntimeexceptionservicesexceptiondispatchinfothrow systemruntimecompilerservicestaskawaiterhandlenonsuccessanddebuggernotificationtask task systemruntimecompilerservicestaskawaitergetresult sourcetreeapponstartupdmovenexterror sourcetreeapp log access deniedsystemcomponentmodelwinexception x access denied systemdiagnosticsprocessstartwithshellexecuteexprocessstartinfo startinfo systemdiagnosticsprocessstartprocessstartinfo startinfo sourcetreesecuritypageantsshkeyagentlaunchboolean promptforkeyifblank string keyfile sourcetreesecuritydefaultsshkeymanagerlaunchsshagentboolean promptforkeyifblank string keyfile sourcetreesecuritydefaultsshkeymanagerlaunchsshagentboolean promptforkeyifblank sourcetreeapprootdostartuptasksafterfirstwindowdisplayed sourcetreemainwindowoncontentrenderedeventargs e systemwindowswindowpostcontentrenderedbobject unused systemwindowsthreadingexceptionwrapperinternalrealcalldelegate callback object args int numargs systemwindowsthreadingexceptionwrappertrycatchwhenobject source delegate callback object args int numargs delegate catchhandlererror sourcetreeapp log access deniedsystemcomponentmodelwinexception x access denied systemdiagnosticsprocessstartwithshellexecuteexprocessstartinfo startinfo systemdiagnosticsprocessstartprocessstartinfo startinfo sourcetreesecuritypageantsshkeyagentlaunchboolean promptforkeyifblank string keyfile sourcetreesecuritydefaultsshkeymanagerlaunchsshagentboolean promptforkeyifblank string keyfile sourcetreesecuritydefaultsshkeymanagerlaunchsshagentboolean promptforkeyifblank sourcetreeapprootdostartuptasksafterfirstwindowdisplayed sourcetreemainwindowoncontentrenderedeventargs e systemwindowswindowpostcontentrenderedbobject unused systemwindowsthreadingexceptionwrapperinternalrealcalldelegate callback object args int numargs systemwindowsthreadingexceptionwrappertrycatchwhenobject source delegate callback object args int numargs delegate catchhandlererror sourcetreeapp log access denied application terminatingsystemcomponentmodelwinexception x access denied systemdiagnosticsprocessstartwithshellexecuteexprocessstartinfo startinfo systemdiagnosticsprocessstartprocessstartinfo startinfo sourcetreesecuritypageantsshkeyagentlaunchboolean promptforkeyifblank string keyfile sourcetreesecuritydefaultsshkeymanagerlaunchsshagentboolean promptforkeyifblank string keyfile sourcetreesecuritydefaultsshkeymanagerlaunchsshagentboolean promptforkeyifblank sourcetreeapprootdostartuptasksafterfirstwindowdisplayed sourcetreemainwindowoncontentrenderedeventargs e systemwindowswindowpostcontentrenderedbobject unused systemwindowsthreadingexceptionwrapperinternalrealcalldelegate callback object args int numargs systemwindowsthreadingexceptionwrappertrycatchwhenobject source delegate callback object args int numargs delegate catchhandler systemwindowsthreadingdispatcheroperationinvokeimpl msinternalculturepreservingexecutioncontextcallbackwrapperobject obj systemthreadingexecutioncontextruninternalexecutioncontext executioncontext contextcallback callback object state boolean preservesyncctx systemthreadingexecutioncontextrunexecutioncontext executioncontext contextcallback callback object state boolean preservesyncctx systemthreadingexecutioncontextrunexecutioncontext executioncontext contextcallback callback object state msinternalculturepreservingexecutioncontextrunculturepreservingexecutioncontext executioncontext contextcallback callback object state systemwindowsthreadingdispatcheroperationinvoke systemwindowsthreadingdispatcherprocessqueue systemwindowsthreadingdispatcherwndprochookintptr hwnd int msg intptr wparam intptr lparam boolean handled mswinhwndwrapperwndprocintptr hwnd int msg intptr wparam intptr lparam boolean handled mswinhwndsubclassdispatchercallbackoperationobject systemwindowsthreadingexceptionwrapperinternalrealcalldelegate callback object args int numargs systemwindowsthreadingexceptionwrappertrycatchwhenobject source delegate callback object args int numargs delegate catchhandler systemwindowsthreadingdispatcherlegacyinvokeimpldispatcherpriority priority timespan timeout delegate method object args int numargs mswinhwndsubclasssubclasswndprocintptr hwnd int msg intptr wparam intptr lparam mswinunsafenativemethodsdispatchmessagemsg msg systemwindowsthreadingdispatcherpushframeimpldispatcherframe frame systemwindowsapplicationrundispatcherobject ignore systemwindowsapplicationruninternalwindow window sourcetreeappmainwe tried several older versions including v v issue closingcrashing couple seconds launchcould please provide workaroundfix thanks,bug,Highest,Bitbucket,Needs Triage
pull push fails atlassian logon window opens sourcetree push,pushing sourcetree v repo last worked jan results ingit c diffmnemonicprefixfalse c corequotepathfalse nooptionallocks push v tags origin mastermasterlogon failed use ctrlc cancel basic credential promptpushing errors see abovenote even though message indicates completed errors logged bitbucket via browser pushes recorded jan using terminal screen appending ctrlc suggested opens atlassian login window password entered returns error broken pipe,bug,High,Bitbucket,Needs Triage
left zone sourcetree workspace list branches scroll top refresh,left zone sourcetree workspace list branchesif long list branches exist scroll selected last branch scroll bottom select another branch see selected branch list refreshed scroll top refresh,bug,Low,General,Needs Triage
sort remote repositories dropdown list items,tens maybe hundreds user groupings hard orientate sortimagepngwidthheight,bug,Low,Bitbucket,Closed
file expands file name different selected custom action,im creating custom action run git command using batch file batch receives parameters repo sha file file supposed expand selected file name sourcetree right reason think bug file seems expand another file name makes batch file work unexpected file see image attached see selected file passed batch custom action libaccdb framed red lower part screen however file passed commonconfigappmsgsql framed red upper part screen real file another folder structure also visible image bottomim also attaching custom action definition referenceimagepng opinion could make batch behave unpredictably making custom actions almost unusable shame,bug,Low,Git,Needs Triage
maximized sourcetree window covers taskbar hidden taskbar left screen,windows taskbar set hide left side screen maximize sourcetree taskbar covered shoving mouse left side screen doesnt activate taskbar alttab another program use win key show taskbarh steps reproduce set windows task bar located left side screen automatically hide shove mouse pointer left side screen see taskbar appear open sourcetree maximize shove mouse onto left side screen see taskbar doesnt appear,bug,Medium,UX,Needs Triage
error creating pull request sourcetree,try create pull request sourcetree bitbucket cloud get following error message something went wrong error loading source branch web browserthe url sourcetree generates trying create pull request seems problem,bug,High,Bitbucket,Closed
diff view show mercurial repositories,select file history uncommitted changes dont see diff fileimagepng,bug,High,hg,Closed
sourcetree reproducable fails basic use case open working directory,git repo created linux border case file names possible unix including newlines file names unit teststry open working copy win mounted smbsourcetree stucks endless loop even refusing show file status normal source filessourcetreelogerror sourcetreeapp log ausnahmen einer aufgabe wurden nicht fcberwacht entweder wegen wartens auf die aufgabe oder wegen des zugriffs auf die ausnahmeeigenschaft daher wurde die nicht fcberwachte ausnahme vom finalizerthread erneut ausgelfstsystemaggregateexception ausnahmen einer aufgabe wurden nicht fcberwacht entweder wegen wartens auf die aufgabe oder wegen des zugriffs auf die ausnahmeeigenschaft daher wurde die nicht fcberwachte ausnahme vom finalizerthread erneut ausgelfst systemargumentexception illegales zeichen im pfad bei systemiopathcheckinvalidpathcharsstring path boolean checkadditional bei systemiopathcombinestring path string path bei sourcetreeutilstreehelperbuildtreefindparentfilestatustreeviewnode start string components filestatusentitytype foldertype nullable ischecked bei sourcetreeutilstreehelperbuildtreefindparentatrootlist tree string components filestatusentitytype foldertype nullable ischecked bei sourcetreeutilstreehelperflatfileentitylisttotreeienumerable records bei sourcetreeviewmodelchangesetsworkingcopychangesetviewmodelrefreshfilelistdmovenext ende der stapelfcberwachung vom vorhergehenden ort dem die ausnahme ausgelfst wurde bei systemruntimeexceptionservicesexceptiondispatchinfothrow bei systemruntimecompilerservicestaskawaiterhandlenonsuccessanddebuggernotificationtask task bei systemruntimecompilerservicestaskawaitergetresult bei sourcetreeviewmodelchangesetsworkingcopychangesetviewmodelactivatebdmovenext ende der internen ausnahmestapelfcberwachung interne ausnahme systemargumentexception illegales zeichen im pfad bei systemiopathcheckinvalidpathcharsstring path boolean checkadditional bei systemiopathcombinestring path string path bei sourcetreeutilstreehelperbuildtreefindparentfilestatustreeviewnode start string components filestatusentitytype foldertype nullable ischecked bei sourcetreeutilstreehelperbuildtreefindparentatrootlist tree string components filestatusentitytype foldertype nullable ischecked bei sourcetreeutilstreehelperflatfileentitylisttotreeienumerable records bei sourcetreeviewmodelchangesetsworkingcopychangesetviewmodelrefreshfilelistdmovenext ende der stapelfcberwachung vom vorhergehenden ort dem die ausnahme ausgelfst wurde bei systemruntimeexceptionservicesexceptiondispatchinfothrow bei systemruntimecompilerservicestaskawaiterhandlenonsuccessanddebuggernotificationtask task bei systemruntimecompilerservicestaskawaitergetresult bei sourcetreeviewmodelchangesetsworkingcopychangesetviewmodelactivatebdmovenext,bug,Low,General,Needs Triage
upgrade failing,tried upgrade new folder would created without files sourcetree would start deleting directory would work trying upgrade getting errormethod found void sharpcompressreadersireaderextensionswriteentrytofilesharpcompressreadersireader systemstring sharpcompressreadersextractionoptions,bug,Low,General,Closed
diff panel showing changes,diff panel showing differences bottom right side versions version working fine,bug,High,Mercurial,Closed
sourcetree crashes trying clone repository,imagepngwhen set ulr git repository try clone sourcetree crashes closed without message error clone functionality work using sourcetree september version windows,bug,Low,Git,Gathering Impact
update sourcetree windows fails,error displayedmethod found void sharpcompressreadersireaderextensionswriteentrytofilesharpcompressreadersireader systemstring sharpcompressreadersextractionoptionsafter receiving error message cancelling update existing version longer works sourcetree shortcut path must manually edited point subdirectory containing current version sourcetree launched,bug,Highest,General,Closed
wrong translation branch italian,hellothe action branch currently translated italian noun ramo consistency translated action italian verb diramare,bug,Low,General,In Progress
cant start sourcetree updating,try upgrade got error cant start sourcetree,bug,Highest,General,Closed
error updating,update get following errormethod found void sharpcompressreadersireaderextensionswriteentrytofilesharpcompressreadersireader systemstring sharpcompressreadersextractionoptions,bug,Low,General,Closed
sourcetree showing diff says select file view diff,select modified file diff isnt shown adjacent pane says select file view diff even though selected file files correctly show diff others dontim latest versionimagepng,bug,Medium,Mercurial,Short Term Backlog
digital certificate validity period expired,digital certificate validity period expired th nov causing alerts security monitoring software use please see attached screen shot fresh install downloaded installed today main website imagepng,bug,Medium,General,Closed
interactive rebase window keeps resizing,behavior extremely annoying interactive rebase window resizes whenever select commit practical use case makes nearly impossible quickly squash commits using buttons buttons keep moving please remove behavior make window resizable instead,bug,Low,General,Needs Triage
signing certificate expired,certificate used sign executables sourcetree expiredimagepngthumbprint fecefbdbbdacaecccethe executables appear timestamp associated result signing expiredimagepngmy organisation uses application restriction policy whitelisting allowing specific executables launch common configuration enterprise environments process create individual hashbased rules allow executables run shorttermcan next release sourcetree please signed renewed certificate files include timestamp,bug,High,General,Closed
cannot upgrade,trying upgrade get errormy system windows upgraded windows pro windows miss net api required upgradingimagepng,bug,Low,General,Closed
sourcetree seems positive agenttesla,hi atlassian teamvirustotal marks sourcetree setup file version positive agenttesla please check verify sideregardsyavor hristov,bug,Medium,Git,Closed
