Summary,Description,Issue Type,Priority,Component/s,Status
log selected popup window opens background seems working,version please update jira release new versionlog selected seem work fact worksplease make sure window pops top main windowi dual monitor setup maybe reasonbut altm selecting active source tree application task bar see one window grouped windows taskbar main applicationhowever cycle next column taskbar see second sourcetree icon contains group sourcetree windows small log windows tried open please make single group source tree windows taskbar clear multiple windows active window popup front choose log selected,bug,Low,Bitbucket,Needs Triage
using submodules main repository view updated automatically,main repository using submodulesin submodules tabs everything works expected commit entire vie automatically updatedin main repository case every stage commit fetch pull etc manually hit f refresh view option refresh automatically files changed enabledthe option refresh window focused enabled,bug,Low,General,Needs Triage
automatic refresh breaks first repository tab,switch branch actions fiirst opened repository manually hit f refresh tabs automaticly refresh,bug,Low,General,Needs Triage
sourcetree switches back generic account optional extended integration,ive configured sourcetree use remote repository bitbucket settings optional extended integration ive selected usernamebitbucket server remote account however every time close sourcetree reopen remote button red exclamation mark overlay icon remote account optional extended integration switched back generic accountgeneric hostive tried versions versions switches back generic account last version working correctly please fix asap cant find version affects versions dropdown list bug report mandatory field selected first version list please ignore,bug,Low,remote,Closed
sourcetree gui keep sync staging commits branches merges,clicking stage commit branch merge sourctree gui respond action ie files show staged commit doesnt show occured history updated close sourcetree reopen changes commands issued reflectedimagepng imagepng imagepng,bug,Low,General,Needs Triage
detecting ssh keys application closes abruptly,even adding correct public private keys appreciate help,bug,Low,Bitbucket,Needs Triage
cannot install authentication successful next button,tried deleting folder regarding source tree reinstalls luckwhen try install says authentication successful next button become enabled install cannot continue,bug,Low,Bitbucket,Needs Triage
sourcetree repos showing remote tab,happening quite people team sourcetree users see repositories permissions remote tab update latest version sourcetree repositories stop showing remote tab able get users remote repositories show giving read permissions different project repos project b showed seems like bug sourcetree anyone found solution,bug,Low,Bitbucket,Needs Triage
show explorer context menu always disabled,sourcetree version affects version fyi windows new tab page local repositories popup hamburger menu right show explorer always disabled every repository actions show explorer explorer button work,bug,Low,UX,Needs Triage
crash checkout bitbucket,colorffsct vcolor try checkout branch bitbucket v using near branch name sct opening dialog checkout click button checkout sct crashes display crash report dialog send sevceral times crashreport,bug,Low,branch,Needs Triage
saving remote login data,fresch installation colorffvcolor delete appdatalocalatlasian appdatalocalsourcetree completely sct save remote login data bitbucket see red exclamation button remote clearing problem edit url remote account settings red exclamation disappear work close reopen sct red exclamation displayed ad users remote accout set generic account generic host,bug,Low,remote,Closed
affected versions sourcetree windows uptodate jira,last version jira sourcetree windows fields messy well,bug,Low,Web,Needs Triage
auto updatecheck updates updates many weeksmonths,check update features currently tells version latest version incorrect manually download website noticed issue past eventually find new version every couple weeksmonths new version available want notified,bug,Low,General,Needs Triage
repository get deleted per selected local repositories filtering,using sourcetree windows go new tab local repositories use search find repository right click repository select delete confirmation prompted confirmation repository selected includes repository includes folder contains repositories ok delete per list lost repositories application delete repository per selected randomly includes repository almost like search ruin indexing delete random thing,bug,Low,General,Needs Triage
finish feature loosing feature name,use gitflow click finish feature featurename branchname displayed seconds dropdown arrow see rotating donut seconds later feature name dropdown box rotating donut ok button disabledso finish feature merge im fast enough version possible choose affects version,bug,Low,Git,Needs Triage
remote connection problem,hey guys id like ask fix problemeverytime opened sourcetree version im able check list versions warning remote iconimagepng setup correctly account everytime ive open sourcetree warning default remote user setup generic accountimagepng,bug,Low,Git,Needs Triage
sourcetree windows work versions gerrit repositories,configuration use gerrit requires modifying repos origin push refsheadsrefsforthis worked great earlier versions get push window absolutely branches anything impossible push changes unless autopushing using checkmark push directly upon committing ok normal scenarios soon enter complex scenarios like wishing ammend checkedout commit someone else pending gerrit requires creating local branch normally manually tell push correct refsforcorrectbranch impossible see screenshots add comments issue see behaviour latest behaviour versions recent please correct forces teams remain function,bug,Low,Git,Needs Triage
language change default results sourcetree updating automatically,use german os would like sourcetree english therefore changed language optionsupon changes repository display right away pressing f staging files unstaging files checking different branch done wont show f pressed sourcetree version win selected version wrong,bug,Low,General,Needs Triage
discard lines bar sticky anymore,description feature allows select lines code discard note feature works marking lines code press button bar topproblem bar fixed anymore scroll top code use buttonsnotei using version cant select affects versionss dropdown,bug,Low,General,Needs Triage
cannt commit,try index files commit indexingimagepngwidthheight,bug,Low,Bitbucket,Needs Triage
adding extra characters commit,sourcetree adding bunch carat characters ini files committing also adds assume corresponds specific commit adds bunch equal signs,bug,Low,Git,Needs Triage
valid source pathurl,command git c diffmnemonicprefixfalse c corequotepathfalse nooptionallocks lsremote error fatal unable access received http code proxy connectcommand perlexe cusershenneappdatalocalsourcetreeapptoolssvnpl info error systemcomponentmodelwinexception system cannot find file specified,bug,Low,Git,Needs Triage
sourcetree log keeps complaining,windows performed version update kb net framework update kb dont know related yet ui seems sluggishseems failing version update check analytic data despite option disabled seen logs going going couple daysnote version jira allows codejavaerror sourcetreeinstallersquirrelutilsupdatehelper log failed check updatessystemexception failed check updates systemmissingmethodexception method found void splatifullloggerinfosystemstring squirrelupdatemanagercheckforupdateimplcheckforupdatedmovenext systemruntimecompilerservicesasynctaskmethodbuilderstarttstatemachinetstatemachine statemachine squirrelupdatemanagercheckforupdateimplcheckforupdatestring localreleasefile string updateurlorpath boolean ignoredeltaupdates action progress ifiledownloader urldownloader squirrelupdatemanagercheckforupdatedmovenext end stack trace previous location exception thrown systemruntimeexceptionservicesexceptiondispatchinfothrow systemruntimecompilerservicestaskawaiterhandlenonsuccessanddebuggernotificationtask task sourcetreeinstallersquirrelutilsupdatehelpercheckforupdatedmovenext end inner exception stack trace sourcetreeinstallersquirrelutilsupdatehelpercheckforupdatedmovenext end stack trace previous location exception thrown systemruntimeexceptionservicesexceptiondispatchinfothrow systemruntimecompilerservicestaskawaiterhandlenonsuccessanddebuggernotificationtask task sourcetreeinstallersquirrelutilsupdatehelperhasavailableupdatesdmovenexterror sourcetreeanalyticsemauemausubmissionservice log post mau submission failedsystemiofileloadexception could load file assembly timezoneconverter version cultureneutral publickeytokennull one dependencies located assemblys manifest definition match assembly reference exception hresult xfile name timezoneconverter version cultureneutral publickeytokennull atlassiananalyticsserviceclientconvertersianatimezoneconverterwritejsonjsonwriter writer object value jsonserializer serializer newtonsoftjsonserializationjsonserializerinternalwriterserializeconvertablejsonwriter writer jsonconverter converter object value jsoncontract contract jsoncontainercontract collectioncontract jsonproperty containerproperty newtonsoftjsonserializationjsonserializerinternalwriterserializeobjectjsonwriter writer object value jsonobjectcontract contract jsonproperty member jsoncontainercontract collectioncontract jsonproperty containerproperty newtonsoftjsonserializationjsonserializerinternalwriterserializeobjectjsonwriter writer object value jsonobjectcontract contract jsonproperty member jsoncontainercontract collectioncontract jsonproperty containerproperty newtonsoftjsonserializationjsonserializerinternalwriterserializejsonwriter jsonwriter object value type objecttype newtonsoftjsonjsonserializerserializeinternaljsonwriter jsonwriter object value type objecttype newtonsoftjsonjsonconvertserializeobjectinternalobject value type type jsonserializer jsonserializer sourcetreeanalyticsemauemausubmissionservicesubmitbatchdmovenextwrn assembly binding logging turned offto enable assembly bind failure logging set registry value hklmsoftwaremicrosoftfusionenablelog dword note performance penalty associated assembly bind failure loggingto turn feature remove registry value hklmsoftwaremicrosoftfusionenablelogerror sourcetreeanalyticsemauemausubmissionservice log post mau submission failedsystemiofileloadexception could load file assembly timezoneconverter version cultureneutral publickeytokennull one dependencies located assemblys manifest definition match assembly reference exception hresult xfile name timezoneconverter version cultureneutral publickeytokennull atlassiananalyticsserviceclientconvertersianatimezoneconverterwritejsonjsonwriter writer object value jsonserializer serializer newtonsoftjsonserializationjsonserializerinternalwriterserializeconvertablejsonwriter writer jsonconverter converter object value jsoncontract contract jsoncontainercontract collectioncontract jsonproperty containerproperty newtonsoftjsonserializationjsonserializerinternalwriterserializeobjectjsonwriter writer object value jsonobjectcontract contract jsonproperty member jsoncontainercontract collectioncontract jsonproperty containerproperty newtonsoftjsonserializationjsonserializerinternalwriterserializeobjectjsonwriter writer object value jsonobjectcontract contract jsonproperty member jsoncontainercontract collectioncontract jsonproperty containerproperty newtonsoftjsonserializationjsonserializerinternalwriterserializejsonwriter jsonwriter object value type objecttype newtonsoftjsonjsonserializerserializeinternaljsonwriter jsonwriter object value type objecttype newtonsoftjsonjsonconvertserializeobjectinternalobject value type type jsonserializer jsonserializer sourcetreeanalyticsemauemausubmissionservicesubmitbatchdmovenextwrn assembly binding logging turned offto enable assembly bind failure logging set registry value hklmsoftwaremicrosoftfusionenablelog dword note performance penalty associated assembly bind failure loggingto turn feature remove registry value hklmsoftwaremicrosoftfusionenablelogerror sourcetreeanalyticsemauemausubmissionservice log post mau submission failedsystemiofileloadexception could load file assembly timezoneconverter version cultureneutral publickeytokennull one dependencies located assemblys manifest definition match assembly reference exception hresult xfile name timezoneconverter version cultureneutral publickeytokennull atlassiananalyticsserviceclientconvertersianatimezoneconverterwritejsonjsonwriter writer object value jsonserializer serializer newtonsoftjsonserializationjsonserializerinternalwriterserializeconvertablejsonwriter writer jsonconverter converter object value jsoncontract contract jsoncontainercontract collectioncontract jsonproperty containerproperty newtonsoftjsonserializationjsonserializerinternalwriterserializeobjectjsonwriter writer object value jsonobjectcontract contract jsonproperty member jsoncontainercontract collectioncontract jsonproperty containerproperty newtonsoftjsonserializationjsonserializerinternalwriterserializeobjectjsonwriter writer object value jsonobjectcontract contract jsonproperty member jsoncontainercontract collectioncontract jsonproperty containerproperty newtonsoftjsonserializationjsonserializerinternalwriterserializejsonwriter jsonwriter object value type objecttype newtonsoftjsonjsonserializerserializeinternaljsonwriter jsonwriter object value type objecttype newtonsoftjsonjsonconvertserializeobjectinternalobject value type type jsonserializer jsonserializer sourcetreeanalyticsemauemausubmissionservicesubmitbatchdmovenextwrn assembly binding logging turned offto enable assembly bind failure logging set registry value hklmsoftwaremicrosoftfusionenablelog dword note performance penalty associated assembly bind failure loggingto turn feature remove registry value hklmsoftwaremicrosoftfusionenablelogerror sourcetreeanalyticsemauemausubmissionservice log post mau submission failedsystemiofileloadexception could load file assembly timezoneconverter version cultureneutral publickeytokennull one dependencies located assemblys manifest definition match assembly reference exception hresult xfile name timezoneconverter version cultureneutral publickeytokennull atlassiananalyticsserviceclientconvertersianatimezoneconverterwritejsonjsonwriter writer object value jsonserializer serializer newtonsoftjsonserializationjsonserializerinternalwriterserializeconvertablejsonwriter writer jsonconverter converter object value jsoncontract contract jsoncontainercontract collectioncontract jsonproperty containerproperty newtonsoftjsonserializationjsonserializerinternalwriterserializeobjectjsonwriter writer object value jsonobjectcontract contract jsonproperty member jsoncontainercontract collectioncontract jsonproperty containerproperty newtonsoftjsonserializationjsonserializerinternalwriterserializeobjectjsonwriter writer object value jsonobjectcontract contract jsonproperty member jsoncontainercontract collectioncontract jsonproperty containerproperty newtonsoftjsonserializationjsonserializerinternalwriterserializejsonwriter jsonwriter object value type objecttype newtonsoftjsonjsonserializerserializeinternaljsonwriter jsonwriter object value type objecttype newtonsoftjsonjsonconvertserializeobjectinternalobject value type type jsonserializer jsonserializer sourcetreeanalyticsemauemausubmissionservicesubmitbatchdmovenextwrn assembly binding logging turned offto enable assembly bind failure logging set registry value hklmsoftwaremicrosoftfusionenablelog dword note performance penalty associated assembly bind failure loggingto turn feature remove registry value hklmsoftwaremicrosoftfusionenablelogerror sourcetreeanalyticsemauemausubmissionservice log post mau submission failedsystemiofileloadexception could load file assembly timezoneconverter version cultureneutral publickeytokennull one dependencies located assemblys manifest definition match assembly reference exception hresult xfile name timezoneconverter version cultureneutral publickeytokennull atlassiananalyticsserviceclientconvertersianatimezoneconverterwritejsonjsonwriter writer object value jsonserializer serializer newtonsoftjsonserializationjsonserializerinternalwriterserializeconvertablejsonwriter writer jsonconverter converter object value jsoncontract contract jsoncontainercontract collectioncontract jsonproperty containerproperty newtonsoftjsonserializationjsonserializerinternalwriterserializeobjectjsonwriter writer object value jsonobjectcontract contract jsonproperty member jsoncontainercontract collectioncontract jsonproperty containerproperty newtonsoftjsonserializationjsonserializerinternalwriterserializeobjectjsonwriter writer object value jsonobjectcontract contract jsonproperty member jsoncontainercontract collectioncontract jsonproperty containerproperty newtonsoftjsonserializationjsonserializerinternalwriterserializejsonwriter jsonwriter object value type objecttype newtonsoftjsonjsonserializerserializeinternaljsonwriter jsonwriter object value type objecttype newtonsoftjsonjsonconvertserializeobjectinternalobject value type type jsonserializer jsonserializer sourcetreeanalyticsemauemausubmissionservicesubmitbatchdmovenextwrn assembly binding logging turned offto enable assembly bind failure logging set registry value hklmsoftwaremicrosoftfusionenablelog dword note performance penalty associated assembly bind failure loggingto turn feature remove registry value hklmsoftwaremicrosoftfusionenablelogerror sourcetreeanalyticsemauemausubmissionservice log post mau submission failedsystemiofileloadexception could load file assembly timezoneconverter version cultureneutral publickeytokennull one dependencies located assemblys manifest definition match assembly reference exception hresult xfile name timezoneconverter version cultureneutral publickeytokennull atlassiananalyticsserviceclientconvertersianatimezoneconverterwritejsonjsonwriter writer object value jsonserializer serializer newtonsoftjsonserializationjsonserializerinternalwriterserializeconvertablejsonwriter writer jsonconverter converter object value jsoncontract contract jsoncontainercontract collectioncontract jsonproperty containerproperty newtonsoftjsonserializationjsonserializerinternalwriterserializeobjectjsonwriter writer object value jsonobjectcontract contract jsonproperty member jsoncontainercontract collectioncontract jsonproperty containerproperty newtonsoftjsonserializationjsonserializerinternalwriterserializeobjectjsonwriter writer object value jsonobjectcontract contract jsonproperty member jsoncontainercontract collectioncontract jsonproperty containerproperty newtonsoftjsonserializationjsonserializerinternalwriterserializejsonwriter jsonwriter object value type objecttype newtonsoftjsonjsonserializerserializeinternaljsonwriter jsonwriter object value type objecttype newtonsoftjsonjsonconvertserializeobjectinternalobject value type type jsonserializer jsonserializer sourcetreeanalyticsemauemausubmissionservicesubmitbatchdmovenextwrn assembly binding logging turned offto enable assembly bind failure logging set registry value hklmsoftwaremicrosoftfusionenablelog dword note performance penalty associated assembly bind failure loggingto turn feature remove registry value hklmsoftwaremicrosoftfusionenablelogerror sourcetreeanalyticsemauemausubmissionservice log post mau submission failedsystemiofileloadexception could load file assembly timezoneconverter version cultureneutral publickeytokennull one dependencies located assemblys manifest definition match assembly reference exception hresult xfile name timezoneconverter version cultureneutral publickeytokennull atlassiananalyticsserviceclientconvertersianatimezoneconverterwritejsonjsonwriter writer object value jsonserializer serializer newtonsoftjsonserializationjsonserializerinternalwriterserializeconvertablejsonwriter writer jsonconverter converter object value jsoncontract contract jsoncontainercontract collectioncontract jsonproperty containerproperty newtonsoftjsonserializationjsonserializerinternalwriterserializeobjectjsonwriter writer object value jsonobjectcontract contract jsonproperty member jsoncontainercontract collectioncontract jsonproperty containerproperty newtonsoftjsonserializationjsonserializerinternalwriterserializeobjectjsonwriter writer object value jsonobjectcontract contract jsonproperty member jsoncontainercontract collectioncontract jsonproperty containerproperty newtonsoftjsonserializationjsonserializerinternalwriterserializejsonwriter jsonwriter object value type objecttype newtonsoftjsonjsonserializerserializeinternaljsonwriter jsonwriter object value type objecttype newtonsoftjsonjsonconvertserializeobjectinternalobject value type type jsonserializer jsonserializer sourcetreeanalyticsemauemausubmissionservicesubmitbatchdmovenextwrn assembly binding logging turned offto enable assembly bind failure logging set registry value hklmsoftwaremicrosoftfusionenablelog dword note performance penalty associated assembly bind failure loggingto turn feature remove registry value hklmsoftwaremicrosoftfusionenablelogerror sourcetreeanalyticsemauemausubmissionservice log post mau submission failedsystemiofileloadexception could load file assembly timezoneconverter version cultureneutral publickeytokennull one dependencies located assemblys manifest definition match assembly reference exception hresult xfile name timezoneconverter version cultureneutral publickeytokennull atlassiananalyticsserviceclientconvertersianatimezoneconverterwritejsonjsonwriter writer object value jsonserializer serializer newtonsoftjsonserializationjsonserializerinternalwriterserializeconvertablejsonwriter writer jsonconverter converter object value jsoncontract contract jsoncontainercontract collectioncontract jsonproperty containerproperty newtonsoftjsonserializationjsonserializerinternalwriterserializeobjectjsonwriter writer object value jsonobjectcontract contract jsonproperty member jsoncontainercontract collectioncontract jsonproperty containerproperty newtonsoftjsonserializationjsonserializerinternalwriterserializeobjectjsonwriter writer object value jsonobjectcontract contract jsonproperty member jsoncontainercontract collectioncontract jsonproperty containerproperty newtonsoftjsonserializationjsonserializerinternalwriterserializejsonwriter jsonwriter object value type objecttype newtonsoftjsonjsonserializerserializeinternaljsonwriter jsonwriter object value type objecttype newtonsoftjsonjsonconvertserializeobjectinternalobject value type type jsonserializer jsonserializer sourcetreeanalyticsemauemausubmissionservicesubmitbatchdmovenextcode,bug,Low,General,Needs Triage
sourcetree doesnt refresh automatically,gitlab repository files refreshed automatically sourcetree see changes user refresh automatically f refresh toggles options repository settings enabled version couldnt set issue latest affects versions,bug,Low,Git,Closed
installation create start menu shortcuts,installing using downloaded windows installation file sourcetreesetupexe start menu shortcuts createdenvironment windows pro ver os build sourcetree version expected shortcuts installed start menuactual shortcuts installed start menuworkaround create manually looking forced installation path user profile really would prefered choice whateves steps reproduce using sourcetreesetupexe installation file run install app follow installation wizard complete installation shortcuts created sourcetree odd reason installation executable shows installationi also installed using context menu shortcut run administratori reinstalled windows highly doubt part problem knows stranger things happenedi idea affects versions lets select x existthank looking let know want specific install executable take care,bug,Low,General,Needs Triage
open terminal button working anymore,least since maybe earlier also open terminal button isnt working anymore opening terminalit seems also custom actions open separate window checkbox checked opening git bash window anymore running custom actionit seems identical issue existed fixed meantime apparently reintroduced,bug,Low,Git,Closed
syntax highlighting applied newline end file notice,create file language syntax highlighting available sourcetree experience bug sql files dont end newline character add file repository view file diff file add sourcetreeafter last numbered line file diff displayscodejava newline end filecodefor sql files line reads end file coloured blue part file syntax notice appear one colourreproduced sourcetree jira doesnt seem permit option,bug,Low,UX,Needs Triage
first tab never refresh,hiwhen action first tab project fetch pull push change selected branch display never refresh quit start sourcetree resfresh order avoid errors managing project branches thinked local repository recloning project new local repository renamed behaviour change order tabs sourcetree tab first position problem resfresh actions version windows available affects versions list belowthanks,bug,Low,General,Closed
error pushing new branches,create new branch try push push screen check new branch automatically fills remote branch field proper name however confirm push get error remote branch local branch featuretest invalid ref names must follow git refformat rules errors see noticed deleting one char remote branch name reinsert fix problem version im using,bug,Low,branch,Needs Triage
gitignore,gitignore sourcetree,bug,Low,Git,Needs Triage
