Summary,Description,Issue Type,Priority,Component/s,Status
sourcetree doesnt open reinstall windows update,windows update kb source tree stopped launching splashscreen shown app never openned listed task managertried running directly cusersusernameappdatalocalsourcetreeappsourcetreeexe result splashscreen shown app never openned listed task manageralso tried reinstalling sourcetree sourcetreesetupexe happening installer splashcreen shown installer never openneduninstalled app control panel programs features tried install result splashcreen shown installer never opennedremoved sourcetree atlassian folders cusersusernameappdatalocal tried install happened splashcreen shown installer never openned going back cusersusernameappdatalocal folder saw sourcetree folder created files inside including sourcetreeexeso tried run directly cusersusernameappdatalocalsourcetreeappsourcetreeexe result abovethen found folder logs cusersusernameappdatalocalsquirreltempso logs squirrelsetuplog try install sourcetreesetupexe program starting squirrel updater install program starting install writing cusersusernameappdatalocalsquirreltemp program install cusersusernameappdatalocalsourcetree checkforupdateimpl couldnt write staging user id user probably shouldnt get beta anything systemiodirectorynotfoundexception foi possvel localizar uma parte caminho cusersusernameappdatalocalsourcetreepackagesbetaidem systemioerrorwinioerrorint errorcode string maybefullpathem systemiofilestreaminitstring path filemode mode fileaccess access int rights boolean userights fileshare share int buffersize fileoptions options securityattributes secattrs string msgpath boolean bfromproxy boolean uselongpath boolean checkhostem systemiofilestreamctorstring path filemode mode fileaccess access fileshare share int buffersize fileoptions options string msgpath boolean bfromproxy boolean uselongpath boolean checkhostem systemiostreamwritercreatefilestring path boolean append boolean checkhostem systemiostreamwriterctorstring path boolean append encoding encoding int buffersize boolean checkhostem systemiofileinternalwritealltextstring path string contents encoding encoding boolean checkhostem systemiofilewritealltextstring path string contents encoding encodingem squirrelupdatemanagercheckforupdateimplgetorcreatestageduserid checkforupdateimpl failed load local releases starting scratch systemiodirectorynotfoundexception foi possvel localizar uma parte caminho cusersusernameappdatalocalsourcetreepackagesreleasesem systemioerrorwinioerrorint errorcode string maybefullpathem systemiofilestreaminitstring path filemode mode fileaccess access int rights boolean userights fileshare share int buffersize fileoptions options securityattributes secattrs string msgpath boolean bfromproxy boolean uselongpath boolean checkhostem systemiofilestreamctorstring path filemode mode fileaccess access fileshare shareem squirrelutilityloadlocalreleasesstring localreleasefileem squirrelupdatemanagercheckforupdateimplcheckforupdatedmovenext checkforupdateimpl reading releases file cusersusernameappdatalocalsquirreltemp checkforupdateimpl first run local directory corrupt starting scratch applyreleasesimpl writing files app directory cusersusernameappdatalocalsourcetreeapp loghost rigging execution stub sourcetreeexecutionstubexe cusersusernameappdatalocalsourcetreesourcetreeexe applyreleasesimpl squirrel enabled apps cusersusernameappdatalocalsourcetreeappsourcetreeexe applyreleasesimpl starting fixpinnedexecutables applyreleasesimpl examining pin dbeaverlnk applyreleasesimpl examining pin file explorerlnk applyreleasesimpl examining pin google chromelnk applyreleasesimpl fixing tray icons applyreleasesimpl cleandeadversions version applyreleasesimpl cleandeadversions exclude folder app also found errors windows event viewer sorry portuguese errorsevent viewer error aplicativo sourcetreeexeverso framework vdescrio processo foi terminado devido uma exceo sem tratamentoinformaes da exceo systemmanagementmanagementexception em systemmanagementmanagementexceptionthrowwithextendedinfosystemmanagementmanagementstatus em systemmanagementmanagementobjectcollectionmanagementobjectenumeratormovenext em sourcetreeutilswindowsoshelpergetwindowsversion em sourcetreeappctor em sourcetreeappmain event viewer error nome aplicativo com falha sourcetreeexe verso carimbo de datahora xfnome mdulo com falha kernelbasedll verso carimbo de datahora xfcdcdigo de exceo xedeslocamento da falha xfid processo com falha xbhora de incio aplicativo com falha xddbeffbcaminho aplicativo com falha cusersllosscuritibaappdatalocalsourcetreeappsourcetreeexecaminho mdulo com falha cwindowssystemkernelbasedllid relatrio bbdefbaccefecnome completo pacote com falha id aplicativo relativo ao pacote com falha,bug,Low,Git,Needs Triage
windows environment minimizing program maximizing program cause page crash,page look like following figure imagepng,bug,Low,UX,Needs Triage
unable use sourcetree,getting error whenever try clone project,bug,Low,Git,Needs Triage
choosing resolve using mine asks confirm want resolve using,tried use sourcetree see compared tortoisegit first impression rather bad imagepngimagepng,bug,Low,Git,Needs Triage
v crashes clone dialog,new installation winpro workstations device enter repo path clone dialog pointing established git repo nas correctly identified git repo wait icon next advanced options begins spin seconds later enter sourcetree window disappearsi uninstalled installed worked expectedbtw downloaded today default windows release identified beta,bug,Low,General,Needs Triage
issues trtying authenticate,everytime open sourcetree force click settings click repo remotes click generic account click get rid exclamation remoteimagepngearlier week could resolve exclamation remote opened issue within community get solution advised open bug heres link details issue bug whats happening atlassiancom dropdown,bug,Low,Bitbucket,Needs Triage
issue local repositories tabs startup,hellowhen closed reopened sourcetree dont keep last tabs opened keep always tab close long time agoin addition dont keep new local repositories add manually local repositories hand time usefulimagepng close reopenimagepngit worked correctly beforethanks lot help,bug,Low,General,Needs Triage
graphics issues mousing interface,im experiencing multiple graphics issues mousing interface missing graphics distorted text etcim running windows pro uptodatemy graphics card geforce gtx tisourcetree also uptodate ver,bug,Low,General,Needs Triage
buttons getting disappeared hover commitpullfetchstash,application working properly buttons disappearing hover text font file suddenly increases,bug,Low,branch,Needs Triage
unable stage files trunks accented letters present code,accented letter like similar present code stage file fails errorcodejavagit apply failed code error searching formy codeerror patch failedpatch applycodeand following content lastfailedpatchtxt file codecdiff git aiolinkmanagementiolinkparametersmanagementc biolinkmanagementiolinkparametersmanagementc aiolinkmanagementiolinkparametersmanagementc biolinkmanagementiolinkparametersmanagementc parametriioliolrwprocessdatatype pdtmisure se il deviceid pari process data da inviare dovrebbero essere raggi e non le misure faulteepromcorrupted breakcode,bug,Low,Git,Needs Triage
sourcetree let push remote branch local branch,sourcetree let push remote branch local branch local branch behind want make current master,bug,Low,branch,Needs Triage
cannot login app start webpage,dear atlassiani work win without admin rights could find portable version sourcetree therefore successfully using years old sourcetree installed another device copied sure version know find without starting app initial dialog second step trying go attlassian usually since week related webpage work cannot loginimagepng,bug,Low,General,Needs Triage
track clean files doesnt work,dont know whats happen loose lots files project clean status unstage section sourcetree cant stage push repo move section means cant work bitbucket repo anymorethis also docs clean status nobody knows,bug,Low,Bitbucket,Needs Triage
text unreadable password edit dialog dark theme,navigate menu toolsoptionsselect tab general set dark themeselect tab authenticationselect item git saved passwordsclick editthe edit password dialog text button text unreadable,bug,Low,UX,Closed
commit button commit adding file,pending file contains new file commit button commit displays dialog immediately closes assume dialog tell whats wrong flashes fast cant see ithow find whats wrong,bug,Low,Git,Needs Triage
crash editing remote,far reproduceablewhen editing remote using edit button double clicking remote sourcetree crash,bug,Low,General,Needs Triage
stash keep staged changes keep changes,stash changes enable keep staged changes changes deleted anyway im using sourcetree windows version could select nonbeta version dropdown,bug,Low,Git,Needs Triage
sourcetree crashes,source tree crashes everytime open uninstalled installed many times,bug,Low,Git,Closed
sourcetree shipping outdated putty binaries,sourcetree shipping outdated putty binariesapptoolsputty pageantexe plinkexe puttygenexepageant release sourcetreeplink release sourcetreeputtygen release sourcetreenot sure sourcetree fixes get backported current putty version released sourcetree putty version released,bug,Low,General,Closed
move existing tag always fails error,several versions always unable move existing tag imagepng error failed push refshint updates rejected tag already exists remote always push removal tags fetch updates create,bug,Low,Git,Needs Triage
end program cloning empty remote repository,created new repo githubtheres files repo program ends try clone repo githubit ends without error message imagepng,bug,Low,remote,Needs Triage
open local repository drag drop work since,opening local git repository drag drop workas far checked works open new tab drag local git repository local repositories tree window mouse cursor turns disabled sign slashed circle empty area mouse cursor turns droppable sign folder effect drop,bug,Low,General,Needs Triage
cant install sourcetree v,installation config menu possible enter account bcs dead link attlassian website cant skip authorization page,bug,Low,General,Needs Triage
context menu options disappear font blurry,since days sourcetree ui blurry menu compared visual studio menuimagepngwidthheightbut main problem menu options context menus disappear hovering themimagepngimagepngwidthheightit looks like problem text scaling display scalingi selected display scaling windows diaply settings updating sourcetree complete reinstall didnt change anything windows h build sourcetree display scaling resolutions x x doesnt work,bug,Low,UX,Needs Triage
checksummed file size doesnt match update,inapp update update failed stating checksummed file size doesnt match cusersuserappdatalocalsourcetreepackagessourcetreefullnupkg,bug,Low,General,Closed
unable runreinstall sourcetree sourcetree stopped working,ran issue months ago version every time tried run sourcetree got popup saying sourcetree stopped working app would run uninstalled tried reinstalling even installer exe would work getting popup couldnt solve issue version came able reinstall run many months later issue version even though working month two ago tried thing uninstalled reinstalled newer version unable install popup way resolve issueimagepng,bug,Low,Bitbucket,Needs Triage
checksum error update,trying update checksum error popsimagepngwidthheight,bug,Low,UX,Closed
source tree windows v security vulnerability cve lognet,hi issue sourcetree uses lognet vulnerability cve solve vulnerabilitu order use sourcetree securilythank,bug,Low,General,Closed
crashcloning newly created gitlib project without branches files sourcetree crash,imagepng imagepng,bug,Low,General,Needs Triage
crashcloning newly created gitlib project without branches files sourcetree crash,imagepngimagepng,bug,Low,Git,Needs Triage
dictionary file blocks sourcetree starting,using sourcetree v every time start comfirn dialog pop said dictionary file invalid delete chose thentoday update sourcetree version app start upsomehow found solution uninstall version reinstall v start dictionary file thing dialog shows chose yes delete file install version starts normallyim sorry providing exact content confirm dialog since wont show remember dic file related office blablablaand sorry poor english sourcetree great app thank team,bug,Medium,na,Closed
identification,try pushpull constantly throw invalid login errorif go site browser log error sourcetree immediately disappearsi certainly teach seems work,bug,Low,Bitbucket,Needs Triage
context men files unresponsive lfs activated repository,lfs activated bitbucket repository file context menu sourctree becomes unresponsive slow takes several seconds context menu show also moving mouse cursor item item takes several seconds process log adding line git lfs version every menu item change context menu takes seconds imagepng,bug,Low,General,Needs Triage
resolve problem github oauth authentification,imagepng trying clone github repo freshclear installed windowsimagepngimagepng cancelling errorimagepng oauth account configured set default githubcom imagepngoauth token updated imagepng imagepng sourcetree resets oauth account default githubcom manually switching error cloning described upper imagepng imagepng,bug,Low,Askpass,Gathering Impact
gui glitch many buttons,software happened pc windows lasted update nvidia lasted update drivers installed luck think screen k dpiimagepngimagepngimagepng,bug,Low,General,Needs Triage
closing branch one commit create new commit,helloim roberto martignano atlassian consultant getconnected atlassian platinum partner based italyour customer problems bitbucket sourcetreewhen close branch one commit integrated develop branch instead creating new onein first moment working workaround set execute fastforward settings see pic sourcetree update working anymore rebase always executedi set affects version actually idea fix thisthank youroberto,bug,Low,Bitbucket,Needs Triage
sourcetree auto,hi im using bitbucket server v sourcetree v create project create repository bitbucket serverand clone source treethere times works times doesnt sourcetree auto offthere check git repository turns loadinghelp,bug,Low,General,Needs Triage
use virustotal find sourcetree trojan horse,hi allwe use virustotal find sourcetree trojan horse itcan see screenshot use virustotal detect find trojan horsecan anyone check imagepngwe download,bug,Low,Git,Needs Triage
maximized window taskbar,kinda annoying tbh,bug,Low,General,Needs Triage
remote option source tree working click windows source tree application crash,remote option source tree working clicking windows source tree application crashtest case click remote option select account time application responding error generates application crash immediately,bug,Low,Bitbucket,Needs Triage
force push fails silently,attempting force push branch cause push window respawn indefinitely rather trigger push commandpush force cliterminal affected terminal command used workaround power users less technical users unable perform actionwe observe following error logscodejava error sourcetreeviewmodelrepodialogcontainer log calling thread must sta many ui components require systeminvalidoperationexception calling thread must sta many ui components require systemwindowsinputinputmanagerctor systemwindowsinputinputmanagergetcurrentinputmanagerimpl systemwindowsinputkeyboardnavigationctor systemwindowsframeworkelementframeworkservicesctor systemwindowsframeworkelementensureframeworkservices systemwindowsframeworkelementctor systemwindowscontrolscontrolctor systemwindowswindowctor sourcetreeuithemewpfcontrolspermonitordpiwindowctor sourcetreeviewdialogsnotificationdialogwindowctorstring title string message object contentcontrol relaycommand contentcommand string contentcommandlabel string customactionlabel string customcancellabel boolean iserror relaycommand suppressioncommand vistataskdialogicon icon sourcetreenotificationsnotificationsmanagershownotificationdialogtstring title string message tuple customaction string cancellabel string suppressionsetting action suppressionchangedaction object contentcontrol string contentcommandlabel action contentaction sourcetreenotificationsnotificationsmanagershownotificationdialogtstring title string message string details tuple customaction string cancellabel string suppressionsetting action suppressionchangedaction sourcetreenotificationsnotificationsmanagershownotificationdialogtstring title string message string details tuple customaction string cancellabel sourcetreenotificationsnotificationsmanagershownotificationdialogwithyesconfirmationstring title string message string details sourcetreenotificationsnotificationsmanagershownotificationdialogwithyesconfirmationstring title string message sourcetreeviewmodelgitgitpushdialogviewmodelfinalisepush sourcetreeviewmodelgitgitpushdialogviewmodelsubmoduledialogcompletedabstractdialogviewmodel repodlg int returncode sourcetreeviewmodelabstractdialogviewmodelfinishint returncode sourcetreeviewmodelsubmodulecheckdialogviewmodelrefreshsubmodulesdmovenext end stack trace previous location exception thrown systemruntimeexceptionservicesexceptiondispatchinfothrow systemruntimecompilerservicestaskawaiterhandlenonsuccessanddebuggernotificationtask task systemruntimecompilerservicestaskawaitergetresultpre code,bug,Low,Git,Needs Triage
patchbased staging hunk line fails nonutf encoded files,working ansiencoded files contents containing german umlauts setting sourcetrees default encoding windows diffs shown correctly internal diff viewer however staging hunks lines involve umlauts fails git error patch applylooking localappdataatlassiansourcetreelastfailedpatchtxt found sourcetree converts diff ansi utf generate patch file ie umlauts shown correctly viewing patch file utfencoded git care encoding try apply utfencoded patch ansiencoded original file fails whenever patch contains characters representations differ ansi utfin opinion correct way fix bug would stop converting patch content whatever encoding utf git convert back original encoding trying apply quick test converted localappdataatlassiansourcetreelastfailedpatchtxt back ansi encoding executed git apply manually worked similar issue older version sourcetree reported srctreewin,bug,Low,Git,Needs Triage
