Summary,Description,Issue Type,Priority,Component/s,Status
cant clone repository windows,repository c filterlfssmudge c filterlfsrequiredfalse c diffmnemonicprefixfalse c corequotepathfalse nooptionallocks clone branch master dsergeidevgitpadavancloning dsergeidevgitpadavanwarning redirecting invalid path trunkuseripsetipsetxtestsbitmapiptfatal unable checkout working treewarning clone succeeded checkout failedyou inspect checked git statusand retry git restore sourcehead cloning git repo command line cant switch branch featureprometheus,bug,Low,Git,Needs Triage
sourcetree keeps crashing windows,versions issue even since installed sourcetree lenovo laptop sourcetree happily crashing days without crashes days multiple crashes per minute interaction uigeneral context file status page staged files unstaged files scrolls list changes right page scrollable interacting scrolls choosing different files freezes ui cannot resize windows inside app history page commit selected resize window shows commit messageinfoparentetc resize view displays graph diff window besides commit info doesnt scroll window scroll cannot resize windowsimagepngdevice infoimagepng,bug,Low,UX,Needs Triage
file contents renamed files shows new file diff current,using diff current feature selecting file renamed denoted blue r icon file contents new file displayed rather comparing two done commit tab imagepngwidthheight,bug,Low,General,Needs Triage
automatic refresh cannot disabled,automatic refresh app focus action first update wasnt came back cannot disabledany setting refresh name repo settings general settings wont anythingshould reboot refrigerator,bug,Low,UX,Needs Triage
sourcetree doesnt remember remote project configuration restart,right click branch create pull request prompted add url remote detailsoptional extended integration oneimagepng since custom urls supported use workaround works like charm restart sourcetree setting remembered prompted againimagepngif look config file via edit config file apparent change add host url knew enter manually would couldnt find name field running administrator doesnt helpversion,bug,Low,General,Needs Triage
freezehang scrolling file diff,scrolling file diff barely needs scrolled less lines using mouse wheel completely freezes sourcetree making use cpu needs forcefully closedscrolling works without issues diff lines longer fit panethis happens multiple times day making app painful use issues closed without actionsrctreewin reported older version gotten attentionsrctreewin,bug,Low,Git,Closed
crash report,,bug,Low,General,Needs Triage
path environment setting working bash console opened terminal menu,helloi frequently open bash console via terminal menu toolbarbut open way doesnt path environment setting utility app placed folder included path cant foundif run bash console via windows start menu way utility app launched properlyhow open bash proper path set,bug,Low,UX,Needs Triage
,,bug,Low,General,Closed
cannot pull changes,account email id tahsinstreamstechgmailcom username tahsinstreamstech pulling branches getting error attentionmy sourcetree version available version assigned imagepng,bug,Low,branch,Needs Triage
looking closer available seats screen may stop scrolling expected way,steps reproduce open app go search section select result box select resut box select date box tap find tickets select class sleeper tap magnifying glass bottom left scroll tapping lower area represents train screen divided line youve reached bottom try scroll taping upper area screen one line divides areas scroll tapping lower one represents trainexpected result lower area represents train scroll upactual result lower area doesnt scroll app scrolls upper area screen nothing top basically appears new blank section previous upper sectionenvironment iphone iosnotes order ensure bug appears bottom step may need try scroll tapping screen swapping several times try scroll times bug always worksthis problem solved without logic trying scroll works,bug,Low,General,Closed
git enabling push tags remotes cause push never finish,symptomi large project tags installed new system noticed fetch remote worked fine could push remote bitbucket would simply sit nothing minute would see fatal error server unexpectedly closed network connection doesnt matter pushing even basic commit workworkaroundif disable push tags remotes works fine notethis specific repo another workstation setup push works fine even push tags enabledsteps enable push tags make change commit locally push observe work eventually gives error message disable push tags observe works,bug,Low,Bitbucket,Needs Triage
